{
  "checkpoint": "I10",
  "generated_at_utc": "2026-09-20T00:01:25Z",
  "status": "GREEN",
  "fingerprint_sha256": "87cbcf8a64cb58d4eb4ea5292b0a4dd0c29cc206e85ea125a4fc3c023d27bf1f",
  "checks": [
    {"name": "repository_quality", "status": "PASS", "detail": "Repository Quality #388 GREEN on product head cb01f2ce."},
    {"name": "restore_chromium", "status": "PASS", "detail": "I10 Restore Chromium #10 GREEN: 1000 events, no-clobber, reject-before-write, abort rollback and parity."},
    {"name": "export_backup", "status": "PASS", "detail": "I10 Export Backup #14 GREEN."},
    {"name": "storage_health", "status": "PASS", "detail": "I10 Storage Health #17 GREEN."},
    {"name": "game_ui_regression", "status": "PASS", "detail": "I10 Game UI Shell #17 GREEN."},
    {"name": "browser_regression", "status": "PASS", "detail": "Generic Chromium Browser Smoke #87 GREEN."}
  ],
  "file_hashes": {
    "changes/CHG-20260920-003.json": "a06df5e43768a816dd112eba9371b286d1f85726cd45ac911933f7c41e42039b",
    "changes/CHG-20260920-004.json": "4ee77818295066092e73c5bd27cca6c3f6aff633eb2145297f4d2b7f88fb5169",
    "changes/CHG-20260920-005.json": "8d80cf514fa515af109fa1100463c390f2c4fad3d216ed851d50892b9e8e9253",
    "changes/CHG-20260920-006.json": "2be6c2cb3a467e7e899d8228250f7b65de5817e9c37684a381da090788e5e827",
    "changes/CHG-20260920-007.json": "68020d2935e4aea01b624b67f42a7286825b38d16f3fa823d91bf3cfe0e45c65",
    "changes/CHG-20260920-008.json": "e46f371567b9e8e87ca336e3be23659a39590f28571879cb9099d0ccc84fca0f",
    "changes/CHG-20260920-010.json": "37b65d37fa1d7ae5e3ac0ce8f58c68a8bc59471b6e4278f2083fe807dbb99343",
    "changes/CHG-20260920-011.json": "42731838b18beddcb6b92f9fb9e51499a11f7504b27e82ec04de50894fe81dc2"
  },
  "review_mode": "sequential_role_review_no_parallel_agent_runtime",
  "reviews": [
    {"role": "orchestrator", "status": "PASS", "evidence": "I10-A/B/C vollständig; I08/I09 blieben eingefroren und unverändert."},
    {"role": "architecture_guardian", "status": "PASS", "evidence": "Restore ist separate I10-Infrastructure hinter injizierter Application-Capability; kein I08-REOPEN."},
    {"role": "qa_regression", "status": "PASS", "evidence": "Quality #388 sowie Restore #10, Export #14, Storage #17, Game UI #17 und Browser #87 sind GREEN."},
    {"role": "security_integrity", "status": "PASS", "evidence": "Validate-before-mutate, atomarer no-clobber Restore und Abort ohne Teilwrites sind im realen Chromium belegt."},
    {"role": "ux_accessibility", "status": "PASS", "evidence": "Die einzelne I10-C-UX-Verfeinerung bleibt auf browser theme-color begrenzt; Game-Shell-Regression ist GREEN."},
    {"role": "release_evidence", "status": "PASS", "evidence": "Governed Repository-Fingerprint 87cbcf8a64cb58d4eb4ea5292b0a4dd0c29cc206e85ea125a4fc3c023d27bf1f und alle I10 Change Records sind gebunden."}
  ]
}
