{
  "checkpoint": "I07",
  "generated_at_utc": "2026-09-19T07:07:30Z",
  "status": "GREEN",
  "fingerprint_sha256": "c4250a63bf8db351cb3b96eb93064074e1b691b3f673c831e0beac88f9ea4a6d",
  "checks": [
    {"name": "deterministic_replay", "status": "PASS", "detail": "Gleiche Events und gleiches Ruleset liefern denselben Zustand; Eingaben bleiben unverändert."},
    {"name": "fail_closed_replay", "status": "PASS", "detail": "Fehlerhafte Events, Sequenzen, Lamport-Zeiten oder Ruleset-Versionen liefern keinen partiellen Rückgabestate."},
    {"name": "purity_static_guard", "status": "PASS", "detail": "Reducer enthält keine Zeit-, Zufalls-, Storage-/Datei- oder Netzwerkabhängigkeit."},
    {"name": "large_replay_profile", "status": "PASS", "detail": "1000 Event-Envelopes bestanden den konservativen 5000-ms-Replay-Smoke."},
    {"name": "repository_quality", "status": "PASS", "detail": "Quality run 35428443958: Python-3.12-Quality-Step erfolgreich."},
    {"name": "browser_smoke", "status": "PASS", "detail": "Chromium-Smoke des finalen I07-Standes erfolgreich."},
    {"name": "visual_ux_scope", "status": "PASS", "detail": "Exakt eine visuelle UX-Änderung: aktiver Tab erhält font-weight 700; keine Interaktionslogik geändert."}
  ],
  "file_hashes": {
    "changes/CHG-20260919-014.json": "1e56e34623270f52712cb952761ef6eda78c0a519325e572ce5362c36c004d67"
  },
  "review_mode": "sequential_role_review_no_parallel_agent_runtime",
  "reviews": [
    {"role": "orchestrator", "status": "PASS", "evidence": "I07 blieb auf Pure Reducer Foundation plus exakt eine isolierte UX-Änderung begrenzt; I08 wurde nicht vorgezogen."},
    {"role": "architecture_guardian", "status": "PASS", "evidence": "I06-Vertrag bleibt unverändert; I07 konsumiert Events und Ruleset ohne Persistenz."},
    {"role": "qa_regression", "status": "PASS", "evidence": "Fokussierte I07-Tests liefen im Repository-Quality-Gate grün."},
    {"role": "security_integrity", "status": "PASS", "evidence": "Purity-Guard verhindert nichtdeterministische und I/O-Abhängigkeiten im Reducer."},
    {"role": "ux_accessibility", "status": "PASS", "evidence": "Aktiver Tab wird ausschließlich typografisch stärker markiert; Chromium-Smoke blieb grün."},
    {"role": "release_evidence", "status": "PASS", "evidence": "I07-Fingerprint c4250a63bf8db351cb3b96eb93064074e1b691b3f673c831e0beac88f9ea4a6d wurde nach finalem governeden Stand gebunden."}
  ]
}
