{
  "checkpoint": "I12",
  "generated_at_utc": "2026-09-28T00:00:00Z",
  "status": "GREEN",
  "fingerprint_sha256": "cda4e0f4ac7eb7b2afb58e73211b3ae80ea54fb1c83294d5f4a580e7aac8745e",
  "checks": [
    {
      "name": "p3_application_barrier",
      "status": "PASS",
      "detail": "Echte P2-LV-Evidence ist die einzige Schreibquelle; Forgery erreicht den Store nicht und Capability-Surfaces sind exakt."
    },
    {
      "name": "p3_no_clobber_store",
      "status": "PASS",
      "detail": "DB v3 nutzt [world_id,event_id,key_id]; identische Duplicates sind idempotent, Konflikte und Write-Aborts fail-closed."
    },
    {
      "name": "p3_readback",
      "status": "PASS",
      "detail": "Readback ist nach key_id deterministisch, liefert defensive Kopien und lehnt ungueltige IDs sowie korrupte Records ab."
    },
    {
      "name": "p3_upgrade",
      "status": "PASS",
      "detail": "Der reale Chromium-Upgradepfad von I12 DB v2 auf v3 erhaelt vorhandene P1-Signing-Keys und P2-Public-Keys."
    },
    {
      "name": "p3_chromium",
      "status": "PASS",
      "detail": "Realer Chrome-154-Smoke prueft API, Upgrade, Duplicate, Konflikt, Sortierung, defensive Kopien, Korruption und injizierten Write-Fehler."
    },
    {
      "name": "scope_guard",
      "status": "PASS",
      "detail": "Keine UI-, Bootstrap-, Rotation-, Export-, Trusted-Checkpoint-, I08-, I09-, I10- oder I11-Aenderung."
    }
  ],
  "file_hashes": {
    "changes/CHG-20260920-017.json": "9d76cb206dd3e13a0793d4021dd156094e420eb5854180aa345c81cfc785d1f8",
    "changes/CHG-20260920-018.json": "646651048c68e12e3ef6029e96b8139f5196e0faa50f768b651beb6a52d9cad8",
    "changes/CHG-20260920-019.json": "0d5b1235fb738349cda2eefa2cd9f1536592e76818e3ca92e0087510bcdd6dab",
    "changes/CHG-20260920-020.json": "662c49db4c975b5f2fa7381ddde9923f562b5473e9e665b34c5727c9a029fe7d",
    "changes/CHG-20260920-021.json": "cf6d322f432c348e6ea59a8b7512b911e49b5140c1b50f0dd28623f432708429",
    "changes/CHG-20260920-022.json": "96b85d4bc5228171cc22860e9eb5207192f8b60a71ab559d31fdb4572b1b7049",
    "changes/CHG-20260920-023.json": "0a7454e747c5999ea9abc3299daad1c7e2dbac5c3d79b02ec29a4c62f0c1f9d6",
    "changes/CHG-20260920-024.json": "d2f0114ea42788a85c8b1f78941ce70183410318324b33a289cd0e4e82927bb2",
    "changes/CHG-20260920-025.json": "0ee6800acc29ed8ecb5e25ee1473597c64b521db86c91b9a04f356cb04d1157d",
    "changes/CHG-20260920-026.json": "c82d845ca97ad1155877adf72c2ad1e84cd7e0bacecd22d06f4ec26b4eb8c5e9",
    "changes/CHG-20260920-027.json": "acac79a6f327eed5c657eb437b5c064717ce9b187e6cdebe016c11a1e28bbe6e",
    "changes/CHG-20260920-028.json": "b4fc8dd4f42711d0389f9fbdf9cc28eab028133430876dddeca9632a227d5712",
    "changes/CHG-20260920-029.json": "b6b24c1b84b03c8ed1f51ca81e2c95de9097d2e900c45716a2508137d8a08405",
    "changes/CHG-20260920-030.json": "088557d6e15807f536e3fe807b0a2472c4706c2f8cc8cac6188f326f28ff833c",
    "changes/CHG-20260920-031.json": "dee3e403cf01efc6ec8dc7c58eb593a8ca985bfbd9bcf2ad5773c854cf7d0c0c",
    "changes/CHG-20260920-032.json": "a4659a5d6239e1fec3d4ccf285826d05494e2edc445dc62d14971702852160b6",
    "changes/CHG-20260920-033.json": "87ae62d812430560e0e351b3a387e41f6bdfe7a6b08bb2a5aaa00a8009f8b1ef",
    "changes/CHG-20260921-034.json": "13f931361d3665b7a60cb7d8a05812e8e4c4dd31e4169935b628a6e7b94914ac",
    "changes/CHG-20260921-035.json": "9397571e3dd0b48f1f5272d77cab5cad2692bb15aff5b30b2ca2ef2286646ed6",
    "changes/CHG-20260921-036.json": "2c68942418aee9c16f6edbc061d4fb59ae57036751881cb3d2ea2530ad400aa2",
    "changes/CHG-20260921-037.json": "132958159a0ee1af2d186a8db2f1d88d814ae5e3b08767f7bf33b6564db29709",
    "changes/CHG-20260921-038.json": "da81be7a0e6e4b4753538be379ca82bbe446214746c05069aec12049856abc2d",
    "changes/CHG-20260921-039.json": "3ca4e9493e4c022f3010ddc3461cf10039b0692ee333978767ba7775e4d99fd7",
    "changes/CHG-20260921-040.json": "3d33a24cd8d4ab76c1aadbd2ab9efb1ffcc53cb983e0abfcec93bce7a996109a",
    "changes/CHG-20260921-041.json": "d9c71a8a33dac800b6a156dd07c17568eab29965132ee8fc77aa3775e3aa8b19",
    "changes/CHG-20260921-042.json": "b1f0c57809fb72458e4edfd29951fa296b630fd215a660884f83cc34e0efd88a",
    "changes/CHG-20260921-043.json": "31c5ad046d5f6c83ba7bc59b4f4ca661bbadd34d5c029dee2fe8cbeed8c37667",
    "changes/CHG-20260921-044.json": "5065e9cea953dc3610e6093c92a964d69b83b344395ceb2602dffaf4a6271909",
    "changes/CHG-20260921-045.json": "236d46ec1b1fa5c6a3dc1d1c03091549a6ace07d7da275f093647ac74a3e9b28",
    "changes/CHG-20260921-046.json": "e14f88d462ca1db1d4a69319505ff2bd988286a95d8e4d8922c058e37141c162",
    "changes/CHG-20260921-047.json": "07c11a8f7027636116512c19d8a675e5bfd2ac4695cd8a5627ba73a8b5f25c36",
    "changes/CHG-20260928-048.json": "7d3b1d58b832612c1d95576691c705462cb1169e08f84f391ca66e5899e71bb3",
    "changes/CHG-20260928-049.json": "bbe225b1db2f558f61d62eda9501062b8af22b3d865da32a6270df3635df7f41",
    "changes/CHG-20260928-050.json": "2ca54e8e89d481092cf49d3d74c839567c12daba478cb67c40a760bef4fd5be4"
  },
  "review_mode": "sequential_role_review_no_parallel_agent_runtime",
  "reviews": [
    {
      "role": "orchestrator",
      "status": "PASS",
      "evidence": "P3 Application, Store und gezielte Tests sind der einzige fachliche Scope; Rotation und Folgethemen bleiben gesperrt."
    },
    {
      "role": "architecture_guardian",
      "status": "PASS",
      "evidence": "Application konsumiert ausschliesslich echte P2-LV-Evidence; Browser-Infrastructure bleibt im separaten I12-Datenbankbereich."
    },
    {
      "role": "data_schema_auditor",
      "status": "PASS",
      "evidence": "Additives DB-v3-Upgrade erhaelt P1/P2 und bindet den Signature Store an [world_id,event_id,key_id]."
    },
    {
      "role": "qa_regression",
      "status": "PASS",
      "evidence": "Gezielte Node- und reale Chromium-Pruefungen decken Forgery, No-Clobber, Sortierung, Korruption, Upgrade und Write-Abort ab."
    },
    {
      "role": "security_integrity",
      "status": "PASS",
      "evidence": "Nur echte P2-LV-Evidence erreicht putIfAbsent; freie Records, Boolean-Trust, Konflikt-Clobber und Erfolg vor Commit sind gesperrt."
    },
    {
      "role": "ux_accessibility",
      "status": "PASS",
      "evidence": "UNCHANGED; keine sichtbare UI- oder Interaktionsaenderung."
    },
    {
      "role": "content_canon",
      "status": "PASS",
      "evidence": "UNCHANGED; keine Story-, Content- oder Visual-World-Aenderung."
    },
    {
      "role": "release_evidence",
      "status": "PASS",
      "evidence": "CHG-050 und governed Fingerprint cda4e0f4ac7eb7b2afb58e73211b3ae80ea54fb1c83294d5f4a580e7aac8745e gebunden."
    }
  ]
}
