{
  "checkpoint": "I11",
  "generated_at_utc": "2026-09-20T11:43:34Z",
  "status": "GREEN",
  "fingerprint_sha256": "6ec730aab6959690168b65c1e7d36de191446f426409cc03e9cdc1e016580d73",
  "checks": [
    {
      "name": "repository_quality",
      "status": "PASS",
      "detail": "Quality #436 GREEN auf main d5d50cdfb7a38b23d886b12f0f760defe8e0b142."
    },
    {
      "name": "deterministic_chain",
      "status": "PASS",
      "detail": "Identische kanonische Eventbytes, Genesis und v1-Byte-Rahmung sind durch I11-A-Testvektoren gebunden."
    },
    {
      "name": "negative_integrity_cases",
      "status": "PASS",
      "detail": "Eventänderung, Umordnung und manipulierte Hashglieder werden fail-closed erkannt."
    },
    {
      "name": "empty_world",
      "status": "PASS",
      "detail": "Leere Welt ist deterministisch abgedeckt."
    },
    {
      "name": "browser_profile_1000",
      "status": "PASS",
      "detail": "I11 Chromium #1/#2: 1000 Events; dokumentierter Referenzlauf 70 ms; Manipulation und Umordnung abgewiesen."
    },
    {
      "name": "browser_regression",
      "status": "PASS",
      "detail": "Generic Chromium Browser Smoke #98 GREEN im finalen I11-C-Gate."
    },
    {
      "name": "predecessor_freeze",
      "status": "PASS",
      "detail": "I06/I08/I09/I10 ohne begründeten REOPEN unverändert."
    },
    {
      "name": "scope_guard",
      "status": "PASS",
      "detail": "Kein I12+-Funktionsscope vorgezogen."
    }
  ],
  "file_hashes": {
    "changes/CHG-20260920-012.json": "2673a1724fd6fa055311af9d54175bb894d88a7d5c2535a1d541291b4cf8c831",
    "changes/CHG-20260920-013.json": "bb67b75e51136a17ebe0f0dbfdc481d46599d0e81a9262dc89cd98120bd1c256",
    "changes/CHG-20260920-014.json": "c07fe26cb2457cf93ad0dc8416af7cdd69ea42a1ffb45a95b563ea59f3326a35",
    "changes/CHG-20260920-015.json": "cfc161225635e79027273962e0ae5d55451174bb9038a73e003fdcc227dafc8f",
    "changes/CHG-20260920-016.json": "6c1d49147a80bd530e90c4bfe33cfc809ddb632b01ef6d5d57193e0ab1d0c5b5"
  },
  "review_mode": "sequential_role_review_no_parallel_agent_runtime",
  "reviews": [
    {
      "role": "orchestrator",
      "status": "PASS",
      "evidence": "I11-A/B/C vollständig; alle zehn I11-Exit-Gates geprüft."
    },
    {
      "role": "architecture_guardian",
      "status": "PASS",
      "evidence": "Hashkette bleibt on-demand aus I08 ableitbar; kein I08/I09/I10-REOPEN erforderlich."
    },
    {
      "role": "data_schema_auditor",
      "status": "PASS",
      "evidence": "I06-Event-Envelope, I08-Store und I10-Backup-v1 bleiben unverändert."
    },
    {
      "role": "qa_regression",
      "status": "PASS",
      "evidence": "Main Quality #436 GREEN; I11 Chromium #2 und Browser Smoke #98 waren im finalen I11-C-Gate GREEN."
    },
    {
      "role": "security_integrity",
      "status": "PASS",
      "evidence": "Manipulation, Reihenfolge und Hashglied-Manipulation werden fail-closed erkannt."
    },
    {
      "role": "ux_accessibility",
      "status": "PASS",
      "evidence": "I11-UX-Änderungen blieben isoliert; bestehende Browser/UI-Regressionen blieben GREEN."
    },
    {
      "role": "content_canon",
      "status": "PASS",
      "evidence": "I11 verändert keine Gameplay-/Contentlogik."
    },
    {
      "role": "release_evidence",
      "status": "PASS",
      "evidence": "Frozen I11 governed tree ist an Fingerprint 6ec730aab6959690168b65c1e7d36de191446f426409cc03e9cdc1e016580d73 gebunden; Quality #436 belegt den unveränderten I11-Produktstand vor der Evidence-Bindung."
    }
  ]
}
