{
  "checkpoint": "I02",
  "generated_at_utc": "2026-09-19T00:28:13Z",
  "status": "GREEN",
  "fingerprint_sha256": "47a0c78b52e4bee2d499edeb5c8e3f4740b564bc384b00d719e54aa046dd6bd0",
  "checks": [
    {
      "name": "repository_quality",
      "status": "PASS",
      "detail": "GitHub Actions quality run 35409441770 completed successfully on Ubuntu 24.04 with Python 3.12."
    },
    {
      "name": "schema_registry",
      "status": "PASS",
      "detail": "I02 registry audit, exact-version resolution, lifecycle rules, positive fixture and declared negative fixtures passed inside the repository quality suite."
    },
    {
      "name": "browser_smoke",
      "status": "PASS",
      "detail": "GitHub Actions run 35409441808 passed with Google Chrome 152.0.7977.82; app title, ready marker, version/build ID, diagnostics navigation and aria-busy=false were observed."
    },
    {
      "name": "repository_hygiene",
      "status": "PASS",
      "detail": "Project metadata now reflects I02 -> I03; documentation is indexed; historical master instructions moved to docs/reference without blob modification."
    },
    {
      "name": "freeze_safety",
      "status": "PASS",
      "detail": "Later repository quality runs leave frozen I00 evidence, status and baseline fingerprint unchanged."
    },
    {
      "name": "runtime_scope",
      "status": "PASS",
      "detail": "No app runtime, gameplay, persistence or content activation behavior changed during repository maintenance."
    }
  ],
  "review_mode": "sequential_role_review_no_parallel_agent_runtime",
  "reviews": [
    {
      "role": "orchestrator",
      "status": "PASS",
      "evidence": "Maintenance scope remained limited to repository structure, governance consistency and documentation."
    },
    {
      "role": "architecture_guardian",
      "status": "PASS",
      "evidence": "Repository layout and project manifest were aligned without changing runtime layer boundaries."
    },
    {
      "role": "data_schema_auditor",
      "status": "PASS",
      "evidence": "Project-manifest checkpoint constraints and change-record schema are forward-usable; I02 schema registry remains green."
    },
    {
      "role": "qa_regression",
      "status": "PASS",
      "evidence": "Repository quality and real Chromium smoke both passed on the maintenance candidate."
    },
    {
      "role": "security_integrity",
      "status": "PASS",
      "evidence": "No new trust boundary, persistence surface or runtime dependency was introduced."
    },
    {
      "role": "ux_accessibility",
      "status": "PASS",
      "evidence": "Existing I01 accessible browser shell remained unchanged and passed the real-browser smoke."
    },
    {
      "role": "content_canon",
      "status": "PASS",
      "evidence": "No story, canon or content-package changes were made."
    },
    {
      "role": "release_evidence",
      "status": "PASS",
      "evidence": "I02 fingerprint, CI run IDs, status and maintenance change record are documented."
    }
  ],
  "file_hashes": {}
}
