{
  "checkpoint": "I05",
  "generated_at_utc": "2026-09-19T03:54:00Z",
  "status": "GREEN",
  "fingerprint_sha256": "a2109489bad2acb281dff782a8bae3d344e6474136930ade2376a8d706296c31",
  "checks": [
    {
      "name": "hot_swap_class_coverage",
      "status": "PASS",
      "detail": "Alle vier verbindlichen Hot-Swap-Klassen sind deterministisch abgebildet."
    },
    {
      "name": "safe_text_class",
      "status": "PASS",
      "detail": "Textwechsel ist immediate_safe."
    },
    {
      "name": "fail_closed_unknown_content",
      "status": "PASS",
      "detail": "Unbekannte Contentarten fallen auf restart_required zurück."
    },
    {
      "name": "migration_and_running_world_guards",
      "status": "PASS",
      "detail": "Migration benötigt Bereitschaft plus gestoppte Welt; world_core bleibt während laufender Welt blockiert."
    },
    {
      "name": "registry_lock_non_mutation",
      "status": "PASS",
      "detail": "I05-Entscheidungen verändern Content Registry und Lockfile nicht."
    },
    {
      "name": "repository_quality",
      "status": "PASS",
      "detail": "GitHub Actions quality run 35419813077 completed SUCCESS."
    },
    {
      "name": "chromium_smoke",
      "status": "PASS",
      "detail": "Real Chromium smoke run 35419813098 completed SUCCESS."
    },
    {
      "name": "visual_ux_scope",
      "status": "PASS",
      "detail": "Genau ein visueller UX-Aspekt geändert: globaler Text-Zeilenabstand auf 1.5."
    }
  ],
  "file_hashes": {
    "changes/CHG-20260919-009.json": "d00fc6f68799b09d28c8a5cf0b8f41cf768ed91662437f9c7debe3940c59be7c"
  },
  "review_mode": "sequential_role_review_no_parallel_agent_runtime",
  "reviews": [
    {
      "role": "orchestrator",
      "status": "PASS",
      "evidence": "I05 ist auf eine read-only Hot-Swap-Entscheidungsschicht begrenzt; I00-I04 wurden nicht reopened."
    },
    {
      "role": "architecture_guardian",
      "status": "PASS",
      "evidence": "Hot-Swap-Policy ist von Registry, Lockfile, Inbox und Browser-Runtime getrennt; keine neue Abhängigkeitsrichtung."
    },
    {
      "role": "data_schema_auditor",
      "status": "PASS",
      "evidence": "Bestehende Schema Registry und Content Registry/Lock-Verträge bleiben unverändert."
    },
    {
      "role": "qa_regression",
      "status": "PASS",
      "evidence": "Sechs fokussierte I05-Tests plus vollständiger Repository-Quality-Lauf sind grün."
    },
    {
      "role": "security_integrity",
      "status": "PASS",
      "evidence": "Unbekannte Contentarten fallen fail-closed auf restart_required; Migration und laufende Welt werden explizit gesperrt."
    },
    {
      "role": "ux_accessibility",
      "status": "PASS",
      "evidence": "Einziger visueller Eingriff ist line-height 1.5; realer Chromium-Smoke blieb grün."
    },
    {
      "role": "content_canon",
      "status": "PASS",
      "evidence": "Keine produktiven Story- oder Kanondaten wurden hinzugefügt oder verändert."
    },
    {
      "role": "release_evidence",
      "status": "PASS",
      "evidence": "Quality Run 35419813077 und Chromium Run 35419813098 sind GREEN; Evidence bindet den governeden Fingerprint."
    }
  ]
}
