{
  "checkpoint": "I06",
  "generated_at_utc": "2026-09-19T04:58:30Z",
  "status": "GREEN",
  "fingerprint_sha256": "008000d0eaa03f97093ee18035d852c2d184f7dd7499095bc6cf7693ceedecda",
  "checks": [
    {
      "name": "event_envelope_schema",
      "status": "PASS",
      "detail": "Pflichtfelder und optionale Trace-Felder sind in event-envelope@1.0.0 definiert."
    },
    {
      "name": "sequence_invariant",
      "status": "PASS",
      "detail": "sequence < 1 wird abgewiesen."
    },
    {
      "name": "lamport_invariant",
      "status": "PASS",
      "detail": "negative Lamport-Zeit wird abgewiesen."
    },
    {
      "name": "typed_identity_invariant",
      "status": "PASS",
      "detail": "event_id, author_id und causation_event_id werden gegen I05-ID-Klassen geprüft."
    },
    {
      "name": "unknown_field_rejection",
      "status": "PASS",
      "detail": "Unbekannte Envelope-Felder werden durch das Schema nicht still akzeptiert."
    },
    {
      "name": "canonical_serialization",
      "status": "PASS",
      "detail": "Gleicher Envelope serialisiert unabhängig von Schlüsselreihenfolge byteidentisch."
    },
    {
      "name": "repository_quality",
      "status": "PASS",
      "detail": "GitHub Actions quality run 35422649017 completed SUCCESS."
    },
    {
      "name": "chromium_smoke",
      "status": "PASS",
      "detail": "Real Chromium smoke run 35422649042 completed SUCCESS."
    },
    {
      "name": "visual_ux_scope",
      "status": "PASS",
      "detail": "Genau ein visueller Aspekt: Panel-Fließtexte max-width 68ch."
    }
  ],
  "file_hashes": {
    "changes/CHG-20260919-011.json": "509294a776b345e65a22144fea043f5d93afc048e0777dcaf2965e4b4f91faab"
  },
  "review_mode": "sequential_role_review_no_parallel_agent_runtime",
  "reviews": [
    {
      "role": "orchestrator",
      "status": "PASS",
      "evidence": "I06 ist auf Event Envelope v1 begrenzt; I07 Reducer und I08 Persistenz wurden nicht vorgezogen."
    },
    {
      "role": "architecture_guardian",
      "status": "PASS",
      "evidence": "Envelope-Logik nutzt I05-Identitätsprimitive und Schema Registry; keine Browser-/DB-Abhängigkeit."
    },
    {
      "role": "data_schema_auditor",
      "status": "PASS",
      "evidence": "event-envelope@1.0.0 ist exakt registriert; unbekannte Zusatzfelder werden abgewiesen."
    },
    {
      "role": "qa_regression",
      "status": "PASS",
      "evidence": "Sechs fokussierte I06-Tests plus bestehende Regression bestanden."
    },
    {
      "role": "security_integrity",
      "status": "PASS",
      "evidence": "Ungültige ID-Typen, Sequenzen, Lamport-Zeit und Zusatzfelder schlagen fail-closed fehl."
    },
    {
      "role": "ux_accessibility",
      "status": "PASS",
      "evidence": "Einzige visuelle Änderung ist max-width 68ch für Panel-Fließtexte; Chromium-Smoke blieb grün."
    },
    {
      "role": "content_canon",
      "status": "PASS",
      "evidence": "Keine Story-, Figuren- oder Kanondaten wurden verändert."
    },
    {
      "role": "release_evidence",
      "status": "PASS",
      "evidence": "Quality Run 35422649017 und Chromium Run 35422649042 sind GREEN; Fingerprint ist gebunden."
    }
  ]
}
