{
  "checkpoint": "I09",
  "generated_at_utc": "2026-09-19T22:15:30Z",
  "status": "GREEN",
  "fingerprint_sha256": "2009d43f91522368257afc114eebf94263e4cd2db5ef732380ac781ca0a30e59",
  "checks": [
    {
      "name": "async_read_error_settlement",
      "status": "PASS",
      "detail": "Realer Chromium-Smoke #9: Abort direkt nach queued Read führt zu Replay und null unbehandelten Promise-Rejections."
    },
    {
      "name": "cache_storage_failure_fallback",
      "status": "PASS",
      "detail": "Snapshot-Storage-Ausfall bleibt ein verwerfbarer Cache-Miss; vollständiger Replay bleibt verfügbar."
    },
    {
      "name": "snapshot_regressions",
      "status": "PASS",
      "detail": "Valider, fehlender, korrupter und fingerprint-falscher Snapshot sowie Abort-Schutz bleiben grün."
    },
    {
      "name": "large_world_profile",
      "status": "PASS",
      "detail": "1000-Schritt-Replay-/Readback-Smoke bleibt grün."
    },
    {
      "name": "repository_quality",
      "status": "PASS",
      "detail": "Repository Quality #267/#268/#269 GREEN."
    },
    {
      "name": "browser_smoke",
      "status": "PASS",
      "detail": "Allgemeiner Chromium-Smoke #66/#67 GREEN."
    }
  ],
  "file_hashes": {
    "changes/CHG-20260919-018.json": "d6b3db23bbdbc522aac7ef7388cc959a6be62e014f82ad47142f1ff44cde9a95",
    "changes/CHG-20260920-001.json": "6665e0dfbecf9c8e58eb75d8b64ac116493fde0c5d9e1417893fff02e5b129ad",
    "changes/CHG-20260920-002.json": "543b8ac0ec2fd26ee45ecbfd1bcaaee68f0d766764565fc6a6da09169319d0f5"
  },
  "review_mode": "sequential_role_review_no_parallel_agent_runtime",
  "reviews": [
    {
      "role": "orchestrator",
      "status": "PASS",
      "evidence": "Expliziter I09-REOPEN nur für den post-merge gefundenen asynchronen Read-Fehler; I10 blieb gesperrt."
    },
    {
      "role": "architecture_guardian",
      "status": "PASS",
      "evidence": "Snapshot Cache bleibt separate Infrastructure; I08 Event Store und I06/I07 unverändert."
    },
    {
      "role": "qa_regression",
      "status": "PASS",
      "evidence": "Quality #267/#268/#269, I09 Snapshot-Smoke #8/#9 und Browser-Smoke #66/#67 sind GREEN."
    },
    {
      "role": "security_integrity",
      "status": "PASS",
      "evidence": "Asynchroner IndexedDB-Readfehler settled Request und Transaktion vollständig; Replay bleibt möglich; kein unhandledrejection."
    },
    {
      "role": "release_evidence",
      "status": "PASS",
      "evidence": "I09-Fingerprint 2009d43f91522368257afc114eebf94263e4cd2db5ef732380ac781ca0a30e59 und alle drei I09 Change Records sind gebunden."
    }
  ]
}
