{
  "checkpoint": "I03",
  "generated_at_utc": "2026-09-19T00:38:20Z",
  "status": "GREEN",
  "fingerprint_sha256": "8910921b3b77674079cf9b656634214170417066ac29b8a30deac48eeb268d52",
  "checks": [
    {
      "name": "repository_quality",
      "status": "PASS",
      "detail": "GitHub Actions quality run 35409955960 completed successfully on the final I03 metadata candidate."
    },
    {
      "name": "content_registry_contract",
      "status": "PASS",
      "detail": "Content Registry and Lockfile schemas, exact-version resolver, path confinement, SHA-256 pins and deterministic dependency ordering passed."
    },
    {
      "name": "negative_fixtures",
      "status": "PASS",
      "detail": "Duplicate package, missing dependency, wrong dependency version, tampered lock hash and Registry/Lock drift are rejected with stable SSI-CONTENT error codes."
    },
    {
      "name": "joint_fingerprint",
      "status": "PASS",
      "detail": "Registry and Lockfile are jointly fingerprinted; production registry remains empty/read-only and drift-protected."
    },
    {
      "name": "write_safety",
      "status": "PASS",
      "detail": "Failed resolution does not mutate registry or lockfile. I03 contains no Inbox, quarantine, activation, persistence or package-moving behavior."
    },
    {
      "name": "browser_regression",
      "status": "PASS",
      "detail": "GitHub Actions browser run 35409955870 passed with Google Chrome 152.0.7977.82; I01 browser shell remains operational."
    }
  ],
  "review_mode": "sequential_role_review_no_parallel_agent_runtime",
  "reviews": [
    {
      "role": "orchestrator",
      "status": "PASS",
      "evidence": "Scope matches MASTER v0.4 I03 and excludes I04 activation behavior."
    },
    {
      "role": "architecture_guardian",
      "status": "PASS",
      "evidence": "I03 is implemented as read-only manifests/tools/tests; runtime layer boundaries remain unchanged."
    },
    {
      "role": "data_schema_auditor",
      "status": "PASS",
      "evidence": "Content Registry and Lock schemas are registered in the I02 Schema Registry and validate successfully."
    },
    {
      "role": "qa_regression",
      "status": "PASS",
      "evidence": "Full repository quality and real-browser regression are green."
    },
    {
      "role": "security_integrity",
      "status": "PASS",
      "evidence": "Repository escape paths, hash drift and tampered pins are rejected."
    },
    {
      "role": "ux_accessibility",
      "status": "PASS",
      "evidence": "No UI behavior changed; existing accessible shell passed Chromium smoke."
    },
    {
      "role": "content_canon",
      "status": "PASS",
      "evidence": "No productive story/game content was introduced; only isolated fixtures exist."
    },
    {
      "role": "release_evidence",
      "status": "PASS",
      "evidence": "I03 fingerprint, CI runs, scope and rollback evidence are recorded."
    }
  ],
  "file_hashes": {}
}
